language.title	English	Afrikaans	Albanian	Amharic	Arabic	Armenian		Basque	Belarusian	Bengali	Bhojpuri	Bulgarian	Catalan	Cebuano	Chinese (Simplified)	Chinese (Traditional)	Corsican	Croatian	Czech	Danish	Dutch	Esperanto	Estonian	Filipino (Tagalog)	Finnish	French	Frisian	Galician	Georgian	German	Greek	Guarani	Gujarati	Haitian Creole	Hausa	Hawaiian	Hebrew	Hindi	Hmong	Hungarian	Icelandic	Igbo	Ilocano	Indonesian	Irish	Italian	Japanese	Javanese	Kannada	Kazakh	Khmer	Kinyarwanda	Konkani	Korean	Kurdish	Kyrgyz	Lao	Latin	Latvian	Lingala	Lithuanian	Luganda	Luxembourgish	Macedonian	Maithili	Malagasy	Malay	Malayalam	Maltese	Maori	Marathi	Meiteilon (Manipuri)	Mizo	Mongolian	Myanmar (Burmese)	Nepali	Norwegian	Nyanja (Chichewa)	Odia (Oriya)	Oromo	Pashto	Persian	Polish	Portuguese (Portugal, Brazil)	Punjabi	Quechua	Romanian	Russian	Samoan	Sanskrit	Scots Gaelic	Sepedi	Serbian	Sesotho	Shona	Sindhi	Sinhala (Sinhalese)	Slovak	Slovenian	Somali	Spanish	Sundanese	Swahili	Swedish	Tagalog (Filipino)	Tajik	Tamil	Tatar	Telugu	Thai	Tigrinya	Tsonga	Turkish	Turkmen	Twi (Akan)	Ukrainian	Urdu	Uyghur	Uzbek	Vietnamese	Welsh	Xhosa	Yiddish	Yoruba	Zulu
language.hlCode	eng00	afk00	aln00	amh00	arq00	arm00	aze00	bas29	ruw00	bng00	bwf00	blg00	cat24	ceb00	chn-s	chn-t		hrv00	czc00	dan99	dut99	epo19	est00	tagl00	fin00	frn00	fri29	gln00	geo00	ger00	grk00		gjr00	hat00	hua00	haw98	hbr00	hnd00	mww01	hng00	Ice99			inz00	Iri99	itn00	jpn00	jan00	kjv00	kaz99	kmr00	rua00	gom00	kkn00	kur19	kyr99	nol00	lat777	lat00		lit00	lap00	lux777	mkj00		plt00	mli00	mjs00	mal99	mbf00	mrt00			khk00	bms00	nep00	nor99	nyj00			pbu00	pes00	pql00	por05	pan19		rum00	rus00	smy00				sdd00	sot01	shd00	snd00	sin99	slo00	slv00	som00	spn00	Sud777	swc00	swe99	tgl00	pet00	tcv00	ttr00	tcw00	thj00			trk00	tck00		ukr00	urd00	uig00	uzb00	vie00	wls00	xos00	yid49	yor00	zuu00
language.google	en	af	sq	am	ar	hy	az	eu	be	bn	bs	bg	ca	ceb	zh-CN	zh-TW	co	hr	cs	da	nl	eo	et	fil	fi	fr	fy	gl	ka	de	el	gn	gu	ht	ha	haw	he	hi	hmn	hu	is	ig	ilo	id	ga	it	ja	jv	kn	kk	km	rw	gom	ko	ku	ky	lo	la	lv	ln	lt	lg	lb	mk	mai	mg	ms	ml	mt	mi	mr	mni-Mtei	lus	mn	my	ne	no	ny	or	om	ps	fa	pl	pt	pa	qu	ro	ru	sm	sa	gd	nso	sr	st	sn	sd	si	sk	sl	so	es	su	sw	sv	tl	tg	ta	tt	te	th	ti	ts	tr	tk	ak	uk	ur	ug	uz	vi	cy	xh	yi	yo	zu
look_back.title	Look Back	Kyk Terug	Shiko prapa	ወደ ኋላ ተመልከት	انظر إلى الوراء	Հետ նայիր	Geriyə bax	Atzera begiratu	Азірніся назад	ফিরে তাকান	Pogledaj nazad	Поглед назад	Mira enrere	Tan-aw Balik	回顾	回顧	Fighjate in daretu	Pogledaj nazad	Podívejte se zpět	Se tilbage	Kijk terug	Rigardu Malantaŭen	Vaata tagasi	Tumingin Sa likod	Katso taaksepäin	Regardez en arrière	Sjoch werom	Mira atrás	უკან გაიხედე	Rückblick	Αναπολώ		પાછળ જુઓ	Gade dèyè	Kalli Baya	Nānā i hope	הסתכל אחורה	पीछे देखना	Saib rov qab	Nézz vissza	Horfðu til baka			Melihat Kembali	Féach Siar	Guarda indietro	振り返る	Deleng Mbalik	ಹಿಂತಿರುಗಿ ನೋಡಿ	Артқа қара	មើលទៅក្រោយ	Subiza amaso inyuma		뒤돌아보기	Li Paşê Binêre	Артка кара	ເບິ່ງຄືນ	Respicite	Paskaties atpakaļ		Guarda indietro		Kuckt zréck	Погледни назад		Miverena	Tengok Belakang	തിരിഞ്ഞു നോക്കൂ	Ħares Lura	Titiro Whakamuri	मागे वळून पहा			Эргээд хар	ပြန်ကြည့်	फर्केर हेर	Se tilbake	Yang'anani Kumbuyo	ପଛକୁ ଦେଖ |		شاته وګوره	به عقب نگاه کن	Wspominać	Olhar para trás	ਪਿੱਛੇ ਦੇਖੋ		Privește înapoi	Оглянись назад	Vaai i tua		Seall air ais		Погледај назад	Sheba Morao	Tarisa Kumashure	پُٺتي ڏس	ආපසු හැරී බලන්න	Pozrite sa späť	Poglej nazaj	Dib u eeg	Mirar hacia atrás	Tingali deui	Angalia Nyuma	Se tillbaka	Tumingin Sa likod	Ба қафо нигоҳ кунед	திரும்பிப் பார்	Артка кара	వెనక్కి తిరిగి చూడు	มองย้อนกลับไป			Geriye Bak	Yzyna serediň		Озирнись назад	پیچھے دیکھو	كەينىگە قاراڭ	Orqaga qarang	Nhìn lại	Edrych yn ol	Jinga emva	קוק צוריק	Wo Pada	I-boot camp
look_up.title	Look Up	Kyk op	Shikoni lart	ወደ ላይ ይመልከቱ	ابحث عن	Նայեք Վերև	Yuxarı Baxın	Begiratu Gora	Глядзі ўверх	উপরে দেখুন	Look Up	Погледни нагоре	Mira cap amunt	Pangitaa	抬头	抬頭	Circà	Pogled gore	Vyhledat	Kig op	Kijk omhoog	Rigardu Supren	Vaata üles	Tumingin sa Itaas	Katso ylös	Chercher	Sjoch Up	Mira cara arriba	მაღლა აიხედე	Nachschlagen	Κοιτάζω πάνω		ઉપર જુઓ	Gade anlè	Duba sama	Nānā i lune	חפש למעלה	ऊपर देखो	Saib	Nézz fel	Horfðu upp			Menengadah	Féach Suas	Cercare	見上げる	Ndeleng munggah	ಮೇಲಕ್ಕೆ ನೋಡಿ	Іздеу	រកមើល	Reba hejuru		찾다	Peyda kirin	Look Up	ຊອກຫາ	Levare	Paskaties uz augšu		Cercare		Eropkucken	Погледни нагоре		Hitady	Tengok Atas	തിരയൽ	Ħares 'l fuq	Titiro Runga	वर पहा			Дээшээ хар	ဦးမော့လာသည်	माथि हेर्नुहोस्	Slå opp	Yang'anani	ଦେଖ |		لټون	به بالا نگاه کن	Spojrzeć w górę	Olhar para cima	ਝਾਂਕਨਾ		Priveşte în sus	Искать	Vaa ane		Thoir sùil air		Лоок Уп	Sheba holimo	Tarisa mudenga	ڏسو	සොයන්න	Pozri hore	Poglej gor	Kor u eeg	Buscar	Ningali ka luhur	Tazama Juu	Slå upp	Tumingin sa Itaas	Ҷустуҷӯ кардан	மேலே பார்	Карагыз	పైకి చూడండి	มองขึ้นไป			Bakmak	Serediň		Подивіться вгору	اوپر دیکھو	قاراڭ	Axtarish, izlash	Nhìn lên	Edrych i Fyny	Jonga phezulu	קוק אַרויף	Wa	Bheka
look_forward.title	Look Forward	Kyk vorentoe	Shikoni përpara	ወደፊት መመልከት	أتطلّع لذلك	Նայեք առաջ	İrəli Baxın	Aurrera begira	Глядзі наперад	সামনে তাকান	Look Forward	Поглед напред	Mira endavant	Tan-awa sa unahan	期待	期待	Aspettà ansiosamente	Gledaj naprijed	Těšte se dopředu	Se fremad	Kijk vooruit	Rigardu Antaŭen	Vaata edasi	Tumingin sa Harap	Katso eteenpäin	Avoir hâte	Sjoch foarút	Mire adiante	იყურე წინ	Freuen	Κοίτα μπροστά		આગળ જુઓ	Gade pou pi devan	Sa ido ga	Nānā i mua	הסתכל קדימה	आशा करना	Saib rau pem hauv ntej	Nézz előre	Horfðu fram			Melihat ke Depan	Féach Ar Aghaidh	Guardare avanti	楽しみにする	Deleng Maju	ಮುಂದೆ ನೋಡಿ	Шыдамы таусыла күту	មើលទៅមុខ	Reba Imbere		기대하다	Ji dil libenê man	Алдыга кара	ເບິ່ງໄປຂ້າງຫນ້າ	Exspecto	Skaties uz priekšu		Guardare avanti		Sech op eppes freeën	Гледајте напред		Manantena	Pandang Ke Hadapan	മുന്നോട്ട് നോക്കുക	Ħares 'l quddiem	Titiro whakamua	पुढे पहा			Урагшаа хар	မျှော်လင့်ပါတယ်	अगाडि हेर्नुहोस्	Se fremover	Yang'anani kutsogolo	ଆଗକୁ ଦେଖ |		مخ ته وګوره	به جلو نگاه کنید	Patrz w przyszłość	Esperar ansiosamente	ਸਾਮਣੇ ਵੇਖੋ		Aștept cu nerăbdare	Ожидать	Fia vaai iai		Coimhead air adhart		Лоок Форвард	Lebella	Tarisira	اڳتي ڏسو	ඉදිරිය බලන්න	Tešiť sa dopredu	Poglej naprej	Horey usoco	Esperar	Ngarepkeun	Tazama Mbele	Se framåt	Tumingin sa Harap	Мунтазир шудан	முன்னோக்கி பார்	Алга карагыз	ముందుకు చూడండి	มองไปข้างหน้า			Geleceğe bak	Öňe serediň		Подивіться вперед	آگے دیکھو	ئالدىغا قاراڭ	Kutib qolish	Nhìn về phía trước	Edrych Ymlaen	Njonga phambili	קוק פאָרויס	Mo nreti lati ri	Bheka Phambili
look_back.question.1	What are you thankful for this week?	Waarvoor is jy hierdie week dankbaar?	Për çfarë jeni mirënjohës këtë javë?	በዚህ ሳምንት ምን አመሰግናለሁ?	ما الذي أنت شاكر له هذا الأسبوع؟	Ինչի՞ համար եք շնորհակալ այս շաբաթ:	Bu həftə nəyə görə minnətdarsınız?	Zer eskertzen duzu aste honetan?	За што вы ўдзячны на гэтым тыдні?	এই সপ্তাহের জন্য আপনি কি কৃতজ্ঞ?	Na čemu ste zahvalni ove sedmice?	За какво сте благодарни тази седмица?	Què agraeixes aquesta setmana?	Unsa ang imong gipasalamatan niining semanaha?	这周你感恩什么？	這週你感恩什麼？	Chì ti ringraziu per sta settimana?	Na čemu ste zahvalni ovaj tjedan?	Za co jste tento týden vděční?	Hvad er du taknemmelig for i denne uge?	Waar ben je deze week dankbaar voor?	Pro kio vi dankas ĉi tiun semajnon?	Mille eest sa selle nädala eest tänulik oled?	Ano ang iyong ipinagpapasalamat para sa linggong ito?	Mistä olet kiitollinen tällä viikolla?	De quoi êtes-vous reconnaissant cette semaine ?	Wêr bisto tankber foar dizze wike?	Que agradeces esta semana?	რისთვის ხარ მადლობელი ამ კვირაში?	Wofür sind Sie diese Woche dankbar?	Για τι είστε ευγνώμονες αυτή την εβδομάδα;		તમે આ અઠવાડિયે શેના માટે આભારી છો?	Ki sa ou rekonesan pou semèn sa a?	Me kuke godiya a wannan makon?	He aha kāu e mahalo ai i kēia pule?	על מה אתה אסיר תודה השבוע?	इस सप्ताह आप किस बात के लिए आभारी हैं?	Koj ua tsaug dab tsi rau lub lim tiam no?	Miért vagy hálás ezen a héten?	Hvað ertu þakklátur fyrir þessa vikuna?			Apa yang Anda syukuri minggu ini?	Cad atá tú buíoch as an tseachtain seo?	Per cosa sei grato questa settimana?	今週、何に感謝していますか？	Apa sampeyan matur nuwun kanggo minggu iki?	ಈ ವಾರ ನೀವು ಏನು ಕೃತಜ್ಞರಾಗಿರುತ್ತೀರಿ?	Осы аптада не үшін алғыс айтасыз?	តើអ្នកអរគុណអ្វីសម្រាប់សប្តាហ៍នេះ?	Niki ushimira muri iki cyumweru?		이번 주에 무엇에 감사하셨나요?	Hûn ji bo vê hefteyê ji bo çi spas dikin?	Бул жума үчүн эмнеге ыраазысыз?	ເຈົ້າຂອບໃຈຫຍັງສຳລັບອາທິດນີ້?	Quid tibi gratias pro hac septimana?	Par ko tu esi pateicīgs šonedēļ?		Per cosa sei grato questa settimana?		Fir wat sidd Dir dankbar fir dës Woch?	За што сте благодарни оваа недела?		Inona no isaoranao amin'ity herinandro ity?	Apa yang anda bersyukur untuk minggu ini?	ഈ ആഴ്‌ചയ്‌ക്ക് നിങ്ങൾ എന്താണ് നന്ദിയുള്ളത്?	Din il-ġimgħa għal xiex int grat?	He aha to mihi mo tenei wiki?	या आठवड्यात तुम्ही कशासाठी आभारी आहात?			Энэ долоо хоногт та юунд талархаж байна вэ?	ဒီတစ်ပတ်အတွက် ဘာကို ကျေးဇူးတင်ပါသလဲ။	तपाईं यस हप्ताको लागि के आभारी हुनुहुन्छ?	Hva er du takknemlig for denne uken?	Kodi mumayamikira chiyani sabata ino?	ଏହି ସପ୍ତାହ ପାଇଁ ଆପଣ କ’ଣ କୃତଜ୍ଞ?		تاسو د دې اونۍ لپاره څه مننه کوئ؟	برای چه چیزی در این هفته شکرگزار هستید؟	Za co jesteś wdzięczny w tym tygodniu?	Pelo que você é grato esta semana?	ਤੁਸੀਂ ਇਸ ਹਫ਼ਤੇ ਲਈ ਕਿਸ ਲਈ ਸ਼ੁਕਰਗੁਜ਼ਾਰ ਹੋ?		Pentru ce esti recunoscator saptamana asta?	За что вы благодарны на этой неделе?	O le a se mea e te faafetai ai i lenei vaiaso?		Dè tha thu taingeil airson an t-seachdain seo?		За шта сте захвални ове недеље?	U leboha eng bekeng ee?	Chii chaunotenda nesvondo rino?	ڇا توهان هن هفتي لاء شڪرگذار آهيو؟	මේ සතියේ ඔබ ස්තුතිවන්ත වන්නේ කුමක් ද?	Za čo ste tento týždeň vďační?	Za kaj ste hvaležni ta teden?	Maxaad ugu mahadsantahay usbuucan?	¿De qué estás agradecido esta semana?	Naon anu anjeun hatur nuhun pikeun minggu ieu?	Unashukuru nini kwa wiki hii?	Vad är du tacksam för den här veckan?	Ano ang iyong ipinagpapasalamat para sa linggong ito?	Шумо барои ин ҳафта чӣ миннатдоред?	இந்த வாரம் நீங்கள் எதற்கு நன்றி கூறுகிறீர்கள்?	Бу атна өчен сез нәрсә өчен рәхмәтле?	ఈ వారం మీరు దేనికి కృతజ్ఞతలు తెలుపుతున్నారు?	สัปดาห์นี้คุณรู้สึกขอบคุณอะไร?			Bu hafta neye şükrediyorsun?	Bu hepde näme üçin minnetdar?		За що ви вдячні цього тижня?	آپ اس ہفتے کے لیے کس چیز کے شکر گزار ہیں؟	بۇ ھەپتە نېمىگە رەھمەت ئېيتىسىز؟	Bu hafta uchun nima uchun minnatdorsiz?	Bạn biết ơn điều gì trong tuần này?	Beth ydych chi'n ddiolchgar amdano yr wythnos hon?	Yintoni oyibulelayo ngale veki?	וואָס זענען איר דאַנקבאַר פֿאַר די וואָך?	Kini o ṣeun fun ọsẹ yii?	Yini oyibongayo kuleli sonto?
look_back.question.2	What are you struggling with and how can we help?	Waarmee sukkel jy en hoe kan ons help?	Me çfarë po luftoni dhe si mund t'ju ndihmojmë?	በምን እየታገልክ ነው እና እንዴት ልንረዳ እንችላለን?	ما هي الصعوبات التي تواجهك وكيف يمكننا مساعدتك؟	Ինչի՞ հետ եք պայքարում և ինչպե՞ս կարող ենք օգնել:	Nə ilə mübarizə aparırsınız və necə kömək edə bilərik?	Zerekin ari zara borrokan eta nola lagundu dezakegu?	З чым вы змагаецеся і чым мы можам дапамагчы?	আপনি কি সঙ্গে সংগ্রাম করছেন এবং আমরা কিভাবে সাহায্য করতে পারেন?	Sa čime se borite i kako vam možemo pomoći?	С какво се борите и как можем да помогнем?	Amb què estàs lluitant i com et podem ajudar?	Unsa ang imong gipakigbisogan ug unsaon namo pagtabang?	您遇到了什么困难？我们能为您提供什么帮助？	您遇到了什麼困難？我們能為您提供什麼協助？	Chì avete a lotta è cumu pudemu aiutà?	S čime se borite i kako vam možemo pomoći?	S čím se potýkáte a jak vám můžeme pomoci?	Hvad kæmper du med, og hvordan kan vi hjælpe?	Waar worstelt u mee en hoe kunnen wij u helpen?	Kion vi luktas kaj kiel ni povas helpi?	Millega teil on probleeme ja kuidas saame aidata?	Ano ang iyong pinaghirapan at paano kami makakatulong?	Minkä kanssa kamppailet ja miten voimme auttaa?	Quels sont vos problèmes et comment pouvons-nous vous aider ?	Wêr hawwe jo muoite mei en hoe kinne wy ​​helpe?	Con que estás loitando e como podemos axudar?	რა გაწუხებთ და როგორ შეგვიძლია დაგეხმაროთ?	Womit haben Sie zu kämpfen und wie können wir Ihnen helfen?	Με τι παλεύετε και πώς μπορούμε να βοηθήσουμε;		તમે શું સાથે સંઘર્ષ કરી રહ્યા છો અને અમે કેવી રીતે મદદ કરી શકીએ?	Ki sa w ap lite ak ki jan nou ka ede?	Me kuke fama dashi kuma ta yaya zamu iya taimakawa?	He aha kāu e hakakā nei a pehea mākou e kōkua ai?	במה אתה מתמודד ואיך אנחנו יכולים לעזור?	आप किस समस्या से जूझ रहे हैं और हम आपकी कैसे मदद कर सकते हैं?	Koj tawm tsam dab tsi thiab peb yuav pab tau li cas?	Mivel küzd, és hogyan segíthetünk?	Hvað ertu að berjast við og hvernig getum við aðstoðað?			Apa yang sedang Anda hadapi dan bagaimana kami dapat membantu?	Cad leis a bhfuil tú ag streachailt agus conas is féidir linn cabhrú?	Quali sono i tuoi problemi e come possiamo aiutarti?	何に困っていますか? また、どのようにお手伝いできますか?	Apa sampeyan berjuang lan kepiye carane bisa mbantu?	ನೀವು ಏನು ಕಷ್ಟಪಡುತ್ತಿದ್ದೀರಿ ಮತ್ತು ನಾವು ಹೇಗೆ ಸಹಾಯ ಮಾಡಬಹುದು?	Сіз немен күресіп жатырсыз және біз қалай көмектесе аламыз?	តើ​អ្នក​ជួប​បញ្ហា​អ្វី ហើយ​តើ​យើង​អាច​ជួយ​បាន​ដោយ​របៀប​ណា?	Niki urwana nacyo kandi twafasha dute?		당신은 어떤 어려움을 겪고 있나요? 어떻게 도와드릴까요?	Hûn bi çi re têkoşîn dikin û em çawa dikarin alîkariyê bikin?	Эмне менен күрөшүп жатасыз жана биз кантип жардам бере алабыз?	ເຈົ້າກຳລັງປະສົບກັບບັນຫາຫຍັງ ແລະພວກເຮົາຈະຊ່ວຍໄດ້ແນວໃດ?	Quid ergo conflictati estis et quomodo adiuvabimus?	Ar ko jūs cīnāties un kā mēs varam palīdzēt?		Quali sono i tuoi problemi e come possiamo aiutarti?		Mat wat kämpft Dir a wéi kënne mir hëllefen?	Со што се мачите и како можеме да помогнеме?		Inona no olana atrehinao ary ahoana no azontsika anampiana?	Apa yang anda sedang bergelut dan bagaimana kami boleh membantu?	നിങ്ങൾ എന്താണ് ബുദ്ധിമുട്ടുന്നത്, ഞങ്ങൾക്ക് എങ്ങനെ സഹായിക്കാനാകും?	Ma' xiex qed tissielet u kif nistgħu ngħinu?	He aha koe e raru ana me pehea e taea ai e matou te awhina?	तुम्ही कशाशी संघर्ष करत आहात आणि आम्ही कशी मदत करू शकतो?			Та юутай тулалдаж байна, бид яаж туслах вэ?	မင်းဘာတွေ ရုန်းကန်နေရလဲ ငါတို့ ဘယ်လိုကူညီနိုင်မလဲ။	तपाईं के संग संघर्ष गर्दै हुनुहुन्छ र हामी कसरी मद्दत गर्न सक्छौं?	Hva sliter du med og hvordan kan vi hjelpe?	Mukulimbana ndi chiyani ndipo tingakuthandizeni bwanji?	ଆପଣ କ’ଣ ସହିତ ସଂଘର୍ଷ କରୁଛନ୍ତି ଏବଂ ଆମେ କିପରି ସାହାଯ୍ୟ କରିପାରିବା?		تاسو د څه سره مبارزه کوئ او موږ څنګه مرسته کولی شو؟	شما با چه مشکلی دست و پنجه نرم می کنید و چگونه می توانیم کمک کنیم؟	Z czym się zmagasz i jak możemy Ci pomóc?	Com o que você está lutando e como podemos ajudar?	ਤੁਸੀਂ ਕਿਸ ਨਾਲ ਸੰਘਰਸ਼ ਕਰ ਰਹੇ ਹੋ ਅਤੇ ਅਸੀਂ ਕਿਵੇਂ ਮਦਦ ਕਰ ਸਕਦੇ ਹਾਂ?		Cu ce ​​te lupți și cum te putem ajuta?	С какими проблемами вы столкнулись и как мы можем вам помочь?	O le a le mea o loʻo e tauivi ai ma e mafai faapefea ona matou fesoasoani?		Cò leis a tha thu a’ strì agus ciamar as urrainn dhuinn do chuideachadh?		Са чиме се мучите и како можемо помоћи?	O sokola ka eng mme re ka o thusa jwang?	Chii chauri kunetsekana nacho uye tingakubatsira sei?	توهان ڇا سان جدوجهد ڪري رهيا آهيو ۽ اسان ڪيئن مدد ڪري سگهون ٿا؟	ඔබ අරගල කරන්නේ කුමක් සඳහාද සහ අපට උපකාර කළ හැක්කේ කෙසේද?	S čím zápasíte a ako vám môžeme pomôcť?	S čim se spopadate in kako vam lahko pomagamo?	Maxaad la halgamaysaa sidee baannu ku caawin karnaa?	¿Con qué estás luchando y cómo podemos ayudarte?	Naon anu anjeun bajoang sareng kumaha urang tiasa ngabantosan?	Unahangaika na nini na tunawezaje kukusaidia?	Vad kämpar du med och hur kan vi hjälpa dig?	Ano ang iyong pinaghirapan at paano kami makakatulong?	Шумо бо чӣ мубориза мебаред ва мо чӣ гуна кӯмак карда метавонем?	நீங்கள் என்ன சிரமப்படுகிறீர்கள், நாங்கள் எப்படி உதவ முடியும்?	Сез нәрсә белән көрәшәсез һәм без ничек ярдәм итә алабыз?	మీరు దేనితో పోరాడుతున్నారు మరియు మేము ఎలా సహాయం చేయగలము?	คุณกำลังประสบปัญหาอะไรอยู่ และเราสามารถช่วยเหลือคุณได้อย่างไร?			Neyle mücadele ediyorsunuz ve size nasıl yardımcı olabiliriz?	Näme bilen göreşýärsiňiz we nädip kömek edip bileris?		З чим ви боретеся і як ми можемо допомогти?	آپ کس چیز کے ساتھ جدوجہد کر رہے ہیں اور ہم کس طرح مدد کر سکتے ہیں؟	نېمە ئۈچۈن كۈرەش قىلىۋاتىسىز ، قانداق ياردەم قىلالايمىز؟	Nima bilan kurashyapsiz va biz qanday yordam bera olamiz?	Bạn đang gặp khó khăn gì và chúng tôi có thể giúp bạn như thế nào?	Beth ydych chi'n cael trafferth ag ef a sut gallwn ni helpu?	Usokola ngantoni kwaye singakunceda njani?	מיט וואָס זענען איר סטראַגאַלינג און ווי קענען מיר העלפן?	Kini o n tiraka pẹlu ati bawo ni a ṣe le ṣe iranlọwọ?	Yini obhekene nayo futhi singasiza ngani?
